{
  "schema": "mcp-recon/v0.1/classification",
  "scanned_at": "2026-05-03T00:07:23.991Z",
  "server": {
    "name": "mcp-time",
    "version": "1.27.0"
  },
  "fuzz_informed": true,
  "classifications": [
    {
      "tool": "get_current_time",
      "data_class": "unknown",
      "authority_level": "read",
      "confused_deputy_candidate": false,
      "confidence": 0,
      "rationale": "no rules fired",
      "recommended_caveat": "tool == \"get_current_time\" AND caller == \"<your-caller-id>\" AND now <= @<your-cap-expiry>  // READ unclassified — operator must review"
    },
    {
      "tool": "convert_time",
      "data_class": "unknown",
      "authority_level": "read",
      "confused_deputy_candidate": false,
      "confidence": 0,
      "rationale": "no rules fired",
      "recommended_caveat": "tool == \"convert_time\" AND caller == \"<your-caller-id>\" AND now <= @<your-cap-expiry>  // READ unclassified — operator must review"
    }
  ]
}
