{
  "schema": "mcp-recon/v0.1/classification",
  "scanned_at": "2026-04-29T20:49:01.436Z",
  "server": {
    "name": "memory-server",
    "version": "0.6.3"
  },
  "fuzz_informed": true,
  "classifications": [
    {
      "tool": "create_entities",
      "data_class": "metadata",
      "authority_level": "write",
      "confused_deputy_candidate": false,
      "confidence": 0.73,
      "rationale": "name match \"\\b(create[_-]?(entities|relations))\\b\" → metadata/write (0.70); fuzz: 1/15 accepted → +0.1",
      "recommended_caveat": "tool == \"create_entities\" AND caller == \"<your-caller-id>\" AND now <= @<your-cap-expiry>  // WRITE metadata"
    },
    {
      "tool": "create_relations",
      "data_class": "metadata",
      "authority_level": "write",
      "confused_deputy_candidate": false,
      "confidence": 0.73,
      "rationale": "name match \"\\b(create[_-]?(entities|relations))\\b\" → metadata/write (0.70); fuzz: 1/15 accepted → +0.1",
      "recommended_caveat": "tool == \"create_relations\" AND caller == \"<your-caller-id>\" AND now <= @<your-cap-expiry>  // WRITE metadata"
    },
    {
      "tool": "add_observations",
      "data_class": "metadata",
      "authority_level": "write",
      "confused_deputy_candidate": false,
      "confidence": 0.73,
      "rationale": "name match \"\\b(add[_-]?observations)\\b\" → metadata/write (0.70); fuzz: 1/15 accepted → +0.1",
      "recommended_caveat": "tool == \"add_observations\" AND caller == \"<your-caller-id>\" AND now <= @<your-cap-expiry>  // WRITE metadata"
    },
    {
      "tool": "delete_entities",
      "data_class": "metadata",
      "authority_level": "destructive",
      "confused_deputy_candidate": false,
      "confidence": 0.73,
      "rationale": "name match \"\\b(delete[_-]?(entities|relations|observations))\\b\" → metadata/destructive (0.70); fuzz: 1/15 accepted → +0.1; description has destructive verb → escalate to destructive",
      "recommended_caveat": "tool == \"delete_entities\" AND caller == \"<your-caller-id>\" AND now <= @<your-cap-expiry>"
    },
    {
      "tool": "delete_observations",
      "data_class": "metadata",
      "authority_level": "destructive",
      "confused_deputy_candidate": false,
      "confidence": 0.73,
      "rationale": "name match \"\\b(delete[_-]?(entities|relations|observations))\\b\" → metadata/destructive (0.70); fuzz: 1/15 accepted → +0.1; description has destructive verb → escalate to destructive",
      "recommended_caveat": "tool == \"delete_observations\" AND caller == \"<your-caller-id>\" AND now <= @<your-cap-expiry>"
    },
    {
      "tool": "delete_relations",
      "data_class": "metadata",
      "authority_level": "destructive",
      "confused_deputy_candidate": false,
      "confidence": 0.73,
      "rationale": "name match \"\\b(delete[_-]?(entities|relations|observations))\\b\" → metadata/destructive (0.70); fuzz: 1/15 accepted → +0.1; description has destructive verb → escalate to destructive",
      "recommended_caveat": "tool == \"delete_relations\" AND caller == \"<your-caller-id>\" AND now <= @<your-cap-expiry>"
    },
    {
      "tool": "read_graph",
      "data_class": "metadata",
      "authority_level": "read",
      "confused_deputy_candidate": false,
      "confidence": 0.73,
      "rationale": "name match \"\\b(read[_-]?graph|search[_-]?nodes|open[_-]?nodes)\\b\" → metadata/read (0.70); fuzz: 4/4 accepted → +0.1",
      "recommended_caveat": "tool == \"read_graph\" AND caller == \"<your-caller-id>\" AND now <= @<your-cap-expiry>  // READ metadata"
    },
    {
      "tool": "search_nodes",
      "data_class": "metadata",
      "authority_level": "read",
      "confused_deputy_candidate": false,
      "confidence": 0.73,
      "rationale": "name match \"\\b(read[_-]?graph|search[_-]?nodes|open[_-]?nodes)\\b\" → metadata/read (0.70); fuzz: 7/15 accepted → +0.1",
      "recommended_caveat": "tool == \"search_nodes\" AND caller == \"<your-caller-id>\" AND now <= @<your-cap-expiry>  // READ metadata"
    },
    {
      "tool": "open_nodes",
      "data_class": "metadata",
      "authority_level": "read",
      "confused_deputy_candidate": false,
      "confidence": 0.73,
      "rationale": "name match \"\\b(read[_-]?graph|search[_-]?nodes|open[_-]?nodes)\\b\" → metadata/read (0.70); fuzz: 1/15 accepted → +0.1",
      "recommended_caveat": "tool == \"open_nodes\" AND caller == \"<your-caller-id>\" AND now <= @<your-cap-expiry>  // READ metadata"
    }
  ]
}
