{
  "schema": "mcp-recon/v0.1/classification",
  "scanned_at": "2026-05-01T01:29:32.632Z",
  "server": {
    "name": "example-servers/postgres",
    "version": "0.1.0"
  },
  "fuzz_informed": true,
  "classifications": [
    {
      "tool": "query",
      "data_class": "unknown",
      "authority_level": "write",
      "confused_deputy_candidate": true,
      "confidence": 0,
      "rationale": "description has side-effect verb → escalate one step; user-controllable string arg + non-read authority → confused-deputy candidate",
      "recommended_caveat": "tool == \"query\" AND caller == \"<your-caller-id>\" AND now <= @<your-cap-expiry>  // WRITE unclassified — operator must review"
    }
  ]
}
